Year,Citation,DOI,Type
2021,"Scaggs, S., Gerkey, D., McLaughlin, K. (2021). Linking subsistence harvest diversity and productivity to adaptive capacity in an Alaskan food sharing network. American Journal of Human Biology. Special Issue: Anthropological Insights on Adaptation and Climate Change, Vol. 33 (4): e23573. ",https://doi.org/10.1002/ajhb.23573,Refereed Article (Special Issue)
2021,"Kawa, N., Arceno, M. A., Goeckner, R., Hunter, C., Rhue, S., Scaggs, S., Biwer, M., Downey, S., Field, J., Gremillion, K., McCorriston, J., Willow, A., Newton, E., Moritz, M. (2021). Training Wicked Scientists for a World of Wicked Problems. Humanities & Social Sciences Communications. Vol. 8 (189).",https://doi.org/10.1057/s41599-021-00871-1,Refereed Article
2020,"Downey, S., Gerkey, D., Scaggs, S. (2020). The Milpa Game: a field experiment investigating the social and ecological dynamics of Q'eqchi' Maya swidden agriculture. Human Ecology, Vol. 48: 423-438. ",https://doi.org/10.1007/s10745-020-00169-x,Refereed Article
2020,"Moritz, M., Scaggs, S., Shapiro, C., Hinkelman, S. (2020). Comparative Study of Territoriality across Forager Societies. Human Ecology, Vol. 48: 225-234. ",https://doi.org/10.1007/s10745-020-00141-9,Refereed Article
2019,"Snopkowski, K., Demps, K., Scaggs, S., Griffiths, R., Fulk, K., May, S., Neagle, K., Downs, K., Eugster, M., Amend, T., Heath, J. (2019). Small Group Learning is Associated with Reduced Salivary Cortisol and Testosterone in Undergraduate Students. Journal of the Scholarship of Teaching and Learning, Vol. 19 (5): 36-52.",https://doi.org/10.14434/josotl.v19i5.24230.,Refereed Article
2017,"Scaggs, S. A., Fulk, K., Glass, D. J., Ziker, J. P. (2017) Framing charitable solicitation in a behavioral experiment: Cues derived from evolutionary theory of cooperation and anthropological economics. In Li, M., Tracer, D. P. (eds.) Interdisciplinary Perspectives on Fairness, Equity, and Justice, 153-178. Springer. ",https://doi.org/10.1007/978-3-319-58993-0_10,Edited Volume
